{
  "schemaVersion": "0.2.16",
  "id": "station-1",
  "name": "Station 1 (PLACEHOLDER)",
  "model": null,
  "placeholder": true,
  "bed": {"widthMm": 400, "heightMm": 400, "originCorner": "front-left"},
  "grbl": {"s30Max": 1000, "laserMode": true, "homingEnabled": null, "baud": 115200},
  "airAssist": {"supported": null, "command": "M8"},
  "camera": {"type": "unknown"}
}
